{
  "$schema": "https://kinetixui.com/schema/registry-item.json",
  "name": "metric",
  "title": "Metric",
  "description": "Ported onto the KinetixUI token contract.",
  "dependencies": [
    "clsx",
    "lucide-react",
    "tailwind-merge"
  ],
  "registryDependencies": [
    "tokens"
  ],
  "files": [
    {
      "path": "registry/kinetixui/ui/metric.tsx",
      "content": "\"use client\";\n\nimport * as React from \"react\";\nimport { ArrowDown, ArrowUp } from \"lucide-react\";\nimport { cn } from \"@/lib/utils\";\n\n/**\n * Metric — a stat / KPI display: label, value, an optional trend indicator\n * and an optional chart or icon slot (bring your own chart, e.g. compose\n * with `ChartContainer`).\n */\nexport interface MetricProps extends React.HTMLAttributes<HTMLDivElement> {\n  label: React.ReactNode;\n  value: React.ReactNode;\n  trend?: \"up\" | \"down\" | \"neutral\";\n  change?: React.ReactNode;\n  icon?: React.ReactNode;\n  chart?: React.ReactNode;\n}\n\nconst Metric = React.forwardRef<HTMLDivElement, MetricProps>(\n  ({ className, label, value, trend, change, icon, chart, ...props }, ref) => (\n    <div ref={ref} className={cn(\"flex flex-col gap-2 rounded-md border border-input p-4 font-sans\", className)} {...props}>\n      <div className=\"flex items-center justify-between\">\n        <p className=\"text-body-sm text-muted-foreground\">{label}</p>\n        {icon && <span className=\"text-muted-foreground [&_svg]:size-5\">{icon}</span>}\n      </div>\n      {/*\n        Wraps rather than compresses. `justify-between` with two intrinsically-sized children has no\n        give: once the value and the trend together need more than the card's content box, flex has\n        nothing left to take and the pair is painted outside it — measured at 14px past the box on a\n        149px card (\"0.42%\" / \"0.1%\"). Neither child can absorb the loss (a numeral must not be\n        truncated, and splitting an arrow from its figure makes the trend unreadable), so the row\n        gives way instead and the trend drops onto its own line under the value.\n\n        `gap-x-3` rather than `gap-2`: 8px was the floor the compressed row was pinned at, which is\n        exactly how close the two read before they collided. 12px is the spacing the rest of the\n        system uses between related-but-distinct controls.\n\n        `data-kx-metric-pair` is the handle the rendered gate measures this row by\n        (scripts/web-quality-browser.mjs, the `spacing` check). It is a marker, never a styling hook.\n      */}\n      <div data-kx-metric-pair className=\"flex flex-wrap items-end justify-between gap-x-3 gap-y-1\">\n        <p className=\"min-w-0 break-words text-headline-sm font-medium text-foreground\">{value}</p>\n        {trend && (\n          <span\n            className={cn(\n              // Three rules, in the order flex applies them, so the trend degrades one step at a time\n              // instead of being clipped:\n              //   `whitespace-nowrap`  the figure is never broken mid-number\n              //   the row's `flex-wrap`  places items by their natural size BEFORE shrinking any, so a\n              //                         trend too wide to sit beside the value reaches its own line whole\n              //   `min-w-0` + `flex-wrap` here  the last resort, once the trend is alone on a line and\n              //                         that line is still narrower than it (a 158px card at 200% text\n              //                         leaves 92px for a 94px trend): the figure goes under the arrow.\n              // Deliberately no `shrink-0`: it would hold the trend at its natural width and put the\n              // overflow back, which is the defect this replaced.\n              \"inline-flex min-w-0 flex-wrap items-center gap-0.5 whitespace-nowrap text-label-md font-medium\",\n              trend === \"up\" && \"text-success\",\n              trend === \"down\" && \"text-destructive\",\n              trend === \"neutral\" && \"text-muted-foreground\",\n            )}\n          >\n            {trend === \"up\" && <ArrowUp className=\"size-3.5\" />}\n            {trend === \"down\" && <ArrowDown className=\"size-3.5\" />}\n            {change}\n          </span>\n        )}\n      </div>\n      {chart && <div className=\"mt-1\">{chart}</div>}\n    </div>\n  ),\n);\nMetric.displayName = \"Metric\";\n\nexport { Metric };\n",
      "type": "registry:ui",
      "target": "components/ui/metric.tsx"
    },
    {
      "path": "registry/kinetixui/lib/utils.ts",
      "content": "import { type ClassValue, clsx } from \"clsx\";\nimport { extendTailwindMerge } from \"tailwind-merge\";\n\n// The Material type-scale utilities (`text-label-md`, `text-body-sm`, …) come\n// from `fontSize` in tailwind.config.ts. Without this, tailwind-merge reads them\n// as text *colours* and drops a real colour class (`text-primary-foreground`).\nconst twMerge = extendTailwindMerge({\n  extend: {\n    classGroups: {\n      \"font-size\": [\n        {\n          text: [\n            \"display-lg\", \"display-md\", \"display-sm\",\n            \"headline-lg\", \"headline-md\", \"headline-sm\",\n            \"title-lg\", \"title-md\", \"title-sm\", \"title-dialog\",\n            \"label-lg\", \"label-md\", \"label-sm\",\n            \"body-lg\", \"body-md\", \"body-sm\",\n          ],\n        },\n      ],\n    },\n  },\n});\n\n/** Merges Tailwind class names, resolving conflicts (clsx + tailwind-merge). */\nexport function cn(...inputs: ClassValue[]) {\n  return twMerge(clsx(inputs));\n}\n",
      "type": "registry:lib",
      "target": "lib/utils.ts"
    }
  ],
  "type": "registry:ui"
}