{
  "$schema": "https://kinetixui.com/schema/registry-item.json",
  "name": "image",
  "title": "Image",
  "description": "Ported onto the KinetixUI token contract.",
  "dependencies": [
    "clsx",
    "lucide-react",
    "tailwind-merge"
  ],
  "registryDependencies": [
    "tokens"
  ],
  "files": [
    {
      "path": "registry/kinetixui/ui/image.tsx",
      "content": "\"use client\";\n\nimport * as React from \"react\";\nimport { ImageOff } from \"lucide-react\";\nimport { cn } from \"@/lib/utils\";\n\n/**\n * Image — a ratio-locked image with a muted placeholder while loading and a\n * fallback on error (presets 1:1 / 3:2 / 4:3 / 3:4 / 3:1 / 16:9). Pass\n * `ratio` as a preset string or a number (w / h).\n */\nconst RATIOS: Record<string, number> = {\n  \"1:1\": 1,\n  \"3:2\": 3 / 2,\n  \"4:3\": 4 / 3,\n  \"3:4\": 3 / 4,\n  \"3:1\": 3,\n  \"16:9\": 16 / 9,\n};\n\nexport interface ImageProps extends React.ImgHTMLAttributes<HTMLImageElement> {\n  ratio?: keyof typeof RATIOS | number;\n  rounded?: boolean;\n  fallback?: React.ReactNode;\n}\n\nconst Image = React.forwardRef<HTMLImageElement, ImageProps>(\n  ({ ratio = \"1:1\", rounded = true, fallback, className, alt = \"\", onLoad, onError, ...props }, forwardedRef) => {\n    const [status, setStatus] = React.useState<\"loading\" | \"loaded\" | \"error\">(\"loading\");\n    const innerRef = React.useRef<HTMLImageElement | null>(null);\n    const setRef = React.useCallback(\n      (node: HTMLImageElement | null) => {\n        innerRef.current = node;\n        if (typeof forwardedRef === \"function\") forwardedRef(node);\n        else if (forwardedRef) (forwardedRef as React.MutableRefObject<HTMLImageElement | null>).current = node;\n      },\n      [forwardedRef],\n    );\n    const r = typeof ratio === \"number\" ? ratio : (RATIOS[ratio] ?? 1);\n\n    // A cached image can finish loading before React attaches onLoad (notably\n    // after hydration of a statically-rendered page) — reconcile on mount.\n    React.useEffect(() => {\n      const img = innerRef.current;\n      if (!img) return;\n      if (img.complete) setStatus(img.naturalWidth > 0 ? \"loaded\" : \"error\");\n    }, [props.src]);\n\n    return (\n      <div\n        className={cn(\n          \"relative w-full overflow-hidden bg-muted\",\n          rounded && \"rounded-md\",\n          className,\n        )}\n        style={{ aspectRatio: r }}\n      >\n        {status === \"error\" ? (\n          <div className=\"absolute inset-0 grid place-items-center text-muted-foreground\">\n            {fallback ?? <ImageOff className=\"size-6\" />}\n          </div>\n        ) : (\n          <img\n            ref={setRef}\n            alt={alt}\n            className={cn(\n              \"size-full object-cover transition-opacity duration-base\",\n              status === \"loaded\" ? \"opacity-visible\" : \"opacity-hidden\",\n            )}\n            onLoad={(e) => {\n              setStatus(\"loaded\");\n              onLoad?.(e);\n            }}\n            onError={(e) => {\n              setStatus(\"error\");\n              onError?.(e);\n            }}\n            {...props}\n          />\n        )}\n      </div>\n    );\n  },\n);\nImage.displayName = \"Image\";\n\nexport { Image };\n",
      "type": "registry:ui",
      "target": "components/ui/image.tsx"
    },
    {
      "path": "registry/kinetixui/lib/utils.ts",
      "content": "import { type ClassValue, clsx } from \"clsx\";\nimport { extendTailwindMerge } from \"tailwind-merge\";\n\n// The Material type-scale utilities (`text-label-md`, `text-body-sm`, …) come\n// from `fontSize` in tailwind.config.ts. Without this, tailwind-merge reads them\n// as text *colours* and drops a real colour class (`text-primary-foreground`).\nconst twMerge = extendTailwindMerge({\n  extend: {\n    classGroups: {\n      \"font-size\": [\n        {\n          text: [\n            \"display-lg\", \"display-md\", \"display-sm\",\n            \"headline-lg\", \"headline-md\", \"headline-sm\",\n            \"title-lg\", \"title-md\", \"title-sm\", \"title-dialog\",\n            \"label-lg\", \"label-md\", \"label-sm\",\n            \"body-lg\", \"body-md\", \"body-sm\",\n          ],\n        },\n      ],\n    },\n  },\n});\n\n/** Merges Tailwind class names, resolving conflicts (clsx + tailwind-merge). */\nexport function cn(...inputs: ClassValue[]) {\n  return twMerge(clsx(inputs));\n}\n",
      "type": "registry:lib",
      "target": "lib/utils.ts"
    }
  ],
  "type": "registry:ui"
}