{
  "$schema": "https://kinetixui.com/schema/registry-item.json",
  "name": "slider",
  "title": "Slider",
  "description": "Ported onto the KinetixUI token contract.",
  "dependencies": [
    "@radix-ui/react-slider",
    "clsx",
    "tailwind-merge"
  ],
  "registryDependencies": [
    "tokens"
  ],
  "files": [
    {
      "path": "registry/kinetixui/ui/slider.tsx",
      "content": "\"use client\";\n\nimport * as React from \"react\";\nimport * as SliderPrimitive from \"@radix-ui/react-slider\";\nimport { cn } from \"@/lib/utils\";\n\n/**\n * The element a screen reader treats as the slider is the thumb (`role=\"slider\"`), not the root, so everything\n * that describes it belongs on the thumb: its name (`aria-label`/`aria-labelledby`), a spoken value\n * (`aria-valuetext`, when the number alone does not say it) and its disabled state. Radix marks a disabled root\n * with `aria-disabled`, but the root has no role and a thumb does not inherit it, so the thumb says so itself.\n *\n * Disabled is drawn from `data-disabled`, which Radix sets on the root and the thumb: both are spans, and a span\n * never matches `:disabled`, so `disabled:` utilities would never apply.\n *\n * Radix draws one thumb per `<Thumb>` child, not per value, so a range (`defaultValue={[20, 80]}`) needs one thumb\n * for each value or the values past the first have no handle to drag, focus or read. With more than one thumb a\n * single name cannot tell them apart, so the name moves to the root as a `role=\"group\"` and each thumb keeps the\n * name Radix gives it by position (\"Minimum\"/\"Maximum\", or \"Value 1 of 3\"). A single `aria-valuetext` string can\n * only describe one value, so it is applied to a single thumb only.\n */\nconst Slider = React.forwardRef<\n  React.ElementRef<typeof SliderPrimitive.Root>,\n  React.ComponentPropsWithoutRef<typeof SliderPrimitive.Root>\n>(\n  (\n    {\n      className,\n      \"aria-label\": ariaLabel,\n      \"aria-labelledby\": ariaLabelledBy,\n      \"aria-valuetext\": ariaValueText,\n      ...props\n    },\n    ref,\n  ) => {\n    // Radix reads `defaultValue` once, so an uncontrolled Slider keeps its first count even if `defaultValue` later\n    // changes; a controlled one follows `value`. Counting a later `defaultValue` would draw a thumb with no value and\n    // move the name to a group around the one thumb that is still there.\n    const [uncontrolledCount] = React.useState(() => (props.defaultValue ?? [props.min ?? 0]).length);\n    const count = Math.max(1, props.value ? props.value.length : uncontrolledCount);\n    const range = count > 1;\n    return (\n      <SliderPrimitive.Root\n        ref={ref}\n        role={range ? \"group\" : undefined}\n        aria-label={range ? ariaLabel : undefined}\n        aria-labelledby={range ? ariaLabelledBy : undefined}\n        className={cn(\n          \"relative flex w-full touch-none select-none items-center data-[disabled]:cursor-not-allowed data-[disabled]:opacity-disabled\",\n          className,\n        )}\n        {...props}\n      >\n        <SliderPrimitive.Track className=\"relative h-1.5 w-full grow overflow-hidden rounded-full bg-muted\">\n          <SliderPrimitive.Range className=\"absolute h-full bg-action\" />\n        </SliderPrimitive.Track>\n        {Array.from({ length: count }, (_, index) => (\n          <SliderPrimitive.Thumb\n            key={index}\n            // Radix spreads these after its own position name, so on a range they must be absent, not undefined\n            {...(range\n              ? {}\n              : {\n                  \"aria-label\": ariaLabel,\n                  \"aria-labelledby\": ariaLabelledBy,\n                  \"aria-valuetext\": ariaValueText,\n                })}\n            aria-disabled={props.disabled || undefined}\n            className=\"block size-4 rounded-full border border-action/50 bg-background shadow transition-colors focus-visible:outline-none focus-visible:ring-1 focus-visible:ring-ring\"\n          />\n        ))}\n      </SliderPrimitive.Root>\n    );\n  },\n);\nSlider.displayName = SliderPrimitive.Root.displayName;\n\nexport { Slider };\n",
      "type": "registry:ui",
      "target": "components/ui/slider.tsx"
    },
    {
      "path": "registry/kinetixui/lib/utils.ts",
      "content": "import { type ClassValue, clsx } from \"clsx\";\nimport { extendTailwindMerge } from \"tailwind-merge\";\n\n// The Material type-scale utilities (`text-label-md`, `text-body-sm`, …) come\n// from `fontSize` in tailwind.config.ts. Without this, tailwind-merge reads them\n// as text *colours* and drops a real colour class (`text-primary-foreground`).\nconst twMerge = extendTailwindMerge({\n  extend: {\n    classGroups: {\n      \"font-size\": [\n        {\n          text: [\n            \"display-lg\", \"display-md\", \"display-sm\",\n            \"headline-lg\", \"headline-md\", \"headline-sm\",\n            \"title-lg\", \"title-md\", \"title-sm\", \"title-dialog\",\n            \"label-lg\", \"label-md\", \"label-sm\",\n            \"body-lg\", \"body-md\", \"body-sm\",\n          ],\n        },\n      ],\n    },\n  },\n});\n\n/** Merges Tailwind class names, resolving conflicts (clsx + tailwind-merge). */\nexport function cn(...inputs: ClassValue[]) {\n  return twMerge(clsx(inputs));\n}\n",
      "type": "registry:lib",
      "target": "lib/utils.ts"
    }
  ],
  "type": "registry:ui"
}