{
  "$schema": "https://kinetixui.com/schema/registry-item.json",
  "name": "tabs",
  "title": "Tabs",
  "description": "Ported onto the KinetixUI token contract.",
  "dependencies": [
    "@radix-ui/react-tabs",
    "clsx",
    "tailwind-merge"
  ],
  "registryDependencies": [
    "tokens"
  ],
  "files": [
    {
      "path": "registry/kinetixui/ui/tabs.tsx",
      "content": "\"use client\";\n\nimport * as React from \"react\";\nimport * as TabsPrimitive from \"@radix-ui/react-tabs\";\nimport { cn } from \"@/lib/utils\";\n\n/** Peer content navigation. Text-first tabs share a base rail and a foreground indicator.\n * Stable weight avoids layout shifts. Radix retains selection, focus, keyboard and direction behavior.\n * Horizontal lists scroll locally at narrow widths/large text; vertical lists use the inline-end rail.\n */\nconst Tabs = TabsPrimitive.Root;\n\nconst TabsList = React.forwardRef<\n  React.ElementRef<typeof TabsPrimitive.List>,\n  React.ComponentPropsWithoutRef<typeof TabsPrimitive.List>\n>(({ className, onFocusCapture, ...props }, ref) => (\n  <TabsPrimitive.List\n    ref={ref}\n    data-kx-tabs-list=\"\"\n    onFocusCapture={(event) => {\n      onFocusCapture?.(event);\n      if (event.defaultPrevented) return;\n      const list = event.currentTarget;\n      const tab = event.target as HTMLElement;\n      const l = list.getBoundingClientRect();\n      const t = tab.getBoundingClientRect();\n      // Scroll this list only, without moving the page. Physical geometry works in either direction.\n      const delta = t.left < l.left ? t.left - l.left : t.right > l.right ? t.right - l.right : 0;\n      if (delta && typeof list.scrollBy === \"function\") list.scrollBy({ left: delta, behavior: \"instant\" });\n    }}\n    className={cn(\n      \"inline-flex min-h-11 w-full min-w-0 max-w-full items-stretch justify-start gap-1 overflow-x-auto overscroll-x-contain border-b border-border text-muted-foreground font-sans [scrollbar-width:thin]\",\n      \"data-[orientation=vertical]:flex-col data-[orientation=vertical]:border-b-0 data-[orientation=vertical]:[border-inline-end-width:1px]\",\n      className,\n    )}\n    {...props}\n  />\n));\nTabsList.displayName = TabsPrimitive.List.displayName;\n\nconst TabsTrigger = React.forwardRef<\n  React.ElementRef<typeof TabsPrimitive.Trigger>,\n  React.ComponentPropsWithoutRef<typeof TabsPrimitive.Trigger>\n>(({ className, ...props }, ref) => (\n  <TabsPrimitive.Trigger\n    ref={ref}\n    className={cn(\n      \"inline-flex min-h-11 shrink-0 items-center justify-center gap-2 whitespace-nowrap border-b-2 border-transparent px-3 py-2 text-sm font-medium data-[orientation=vertical]:border-b-0 data-[orientation=vertical]:[border-inline-end-width:2px]\",\n      \"transition-colors duration-fast ease-standard motion-reduce:transition-none\",\n      \"[@media(hover:hover)]:enabled:hover:data-[state=inactive]:bg-foreground/[0.08] [@media(hover:hover)]:enabled:hover:data-[state=inactive]:text-foreground\",\n      \"data-[state=active]:border-foreground data-[state=active]:text-foreground\",\n      \"focus-visible:outline-none focus-visible:!ring-2 focus-visible:ring-inset focus-visible:ring-ring forced-colors:focus-visible:[outline:2px_solid_Highlight] forced-colors:focus-visible:outline-offset-[-2px]\",\n      \"disabled:pointer-events-none disabled:opacity-disabled\",\n      className,\n    )}\n    {...props}\n  />\n));\nTabsTrigger.displayName = TabsPrimitive.Trigger.displayName;\n\nconst TabsContent = React.forwardRef<\n  React.ElementRef<typeof TabsPrimitive.Content>,\n  React.ComponentPropsWithoutRef<typeof TabsPrimitive.Content>\n>(({ className, ...props }, ref) => (\n  <TabsPrimitive.Content\n    ref={ref}\n    className={cn(\"mt-2 focus-visible:outline-none focus-visible:ring-2 focus-visible:ring-ring forced-colors:focus-visible:[outline:2px_solid_Highlight] forced-colors:focus-visible:outline-offset-[-2px]\", className)}\n    {...props}\n  />\n));\nTabsContent.displayName = TabsPrimitive.Content.displayName;\n\nexport { Tabs, TabsList, TabsTrigger, TabsContent };\n",
      "type": "registry:ui",
      "target": "components/ui/tabs.tsx"
    },
    {
      "path": "registry/kinetixui/lib/utils.ts",
      "content": "import { type ClassValue, clsx } from \"clsx\";\nimport { extendTailwindMerge } from \"tailwind-merge\";\n\n// The Material type-scale utilities (`text-label-md`, `text-body-sm`, …) come\n// from `fontSize` in tailwind.config.ts. Without this, tailwind-merge reads them\n// as text *colours* and drops a real colour class (`text-primary-foreground`).\nconst twMerge = extendTailwindMerge({\n  extend: {\n    classGroups: {\n      \"font-size\": [\n        {\n          text: [\n            \"display-lg\", \"display-md\", \"display-sm\",\n            \"headline-lg\", \"headline-md\", \"headline-sm\",\n            \"title-lg\", \"title-md\", \"title-sm\", \"title-dialog\",\n            \"label-lg\", \"label-md\", \"label-sm\",\n            \"body-lg\", \"body-md\", \"body-sm\",\n          ],\n        },\n      ],\n    },\n  },\n});\n\n/** Merges Tailwind class names, resolving conflicts (clsx + tailwind-merge). */\nexport function cn(...inputs: ClassValue[]) {\n  return twMerge(clsx(inputs));\n}\n",
      "type": "registry:lib",
      "target": "lib/utils.ts"
    }
  ],
  "type": "registry:ui"
}