{
  "$schema": "https://kinetixui.com/schema/registry-item.json",
  "name": "kbd",
  "title": "Kbd",
  "description": "Ported onto the KinetixUI token contract.",
  "dependencies": [
    "@radix-ui/react-slot",
    "clsx",
    "tailwind-merge"
  ],
  "registryDependencies": [
    "tokens"
  ],
  "files": [
    {
      "path": "registry/kinetixui/ui/kbd.tsx",
      "content": "\"use client\";\n\nimport * as React from \"react\";\nimport { Slot } from \"@radix-ui/react-slot\";\nimport { cn } from \"@/lib/utils\";\n\n/**\n * Kbd — a single keyboard key glyph, e.g. `<Kbd>⌘</Kbd>`. Wrap several in\n * `KbdGroup` for a shortcut combo (`⌘` `K`). Gap-fill addition (not in the\n * original Figma source) — matches the shadcn/ui Kbd/KbdGroup API shape.\n */\nexport interface KbdProps extends React.HTMLAttributes<HTMLElement> {\n  /** render as the single child element (Radix Slot) instead of <kbd> */\n  asChild?: boolean;\n}\n\nconst Kbd = React.forwardRef<HTMLElement, KbdProps>(({ className, asChild = false, ...props }, ref) => {\n  const Comp = asChild ? Slot : \"kbd\";\n  return (\n    <Comp\n      ref={ref}\n      className={cn(\n        \"inline-flex h-5 min-w-5 items-center justify-center rounded-sm border border-input bg-muted px-1.5 font-sans text-label-sm text-muted-foreground\",\n        className,\n      )}\n      {...props}\n    />\n  );\n});\nKbd.displayName = \"Kbd\";\n\nexport interface KbdGroupProps extends React.HTMLAttributes<HTMLElement> {}\n\n/** Lays out multiple `Kbd` for a shortcut combo — `<KbdGroup><Kbd>⌘</Kbd><Kbd>K</Kbd></KbdGroup>` */\nconst KbdGroup = React.forwardRef<HTMLElement, KbdGroupProps>(({ className, ...props }, ref) => (\n  <kbd ref={ref} className={cn(\"inline-flex items-center gap-1\", className)} {...props} />\n));\nKbdGroup.displayName = \"KbdGroup\";\n\nexport { Kbd, KbdGroup };\n",
      "type": "registry:ui",
      "target": "components/ui/kbd.tsx"
    },
    {
      "path": "registry/kinetixui/lib/utils.ts",
      "content": "import { type ClassValue, clsx } from \"clsx\";\nimport { extendTailwindMerge } from \"tailwind-merge\";\n\n// The Material type-scale utilities (`text-label-md`, `text-body-sm`, …) come\n// from `fontSize` in tailwind.config.ts. Without this, tailwind-merge reads them\n// as text *colours* and drops a real colour class (`text-primary-foreground`).\nconst twMerge = extendTailwindMerge({\n  extend: {\n    classGroups: {\n      \"font-size\": [\n        {\n          text: [\n            \"display-lg\", \"display-md\", \"display-sm\",\n            \"headline-lg\", \"headline-md\", \"headline-sm\",\n            \"title-lg\", \"title-md\", \"title-sm\", \"title-dialog\",\n            \"label-lg\", \"label-md\", \"label-sm\",\n            \"body-lg\", \"body-md\", \"body-sm\",\n          ],\n        },\n      ],\n    },\n  },\n});\n\n/** Merges Tailwind class names, resolving conflicts (clsx + tailwind-merge). */\nexport function cn(...inputs: ClassValue[]) {\n  return twMerge(clsx(inputs));\n}\n",
      "type": "registry:lib",
      "target": "lib/utils.ts"
    }
  ],
  "type": "registry:ui"
}