{
  "$schema": "https://ui.shadcn.com/schema/registry-item.json",
  "name": "accordion",
  "type": "registry:ui",
  "title": "Accordion",
  "description": "Ported onto the KinetixUI token contract.",
  "dependencies": [
    "@radix-ui/react-accordion",
    "lucide-react"
  ],
  "registryDependencies": [
    "tokens"
  ],
  "files": [
    {
      "path": "registry/kinetixui/ui/accordion.tsx",
      "content": "\"use client\";\n\nimport * as React from \"react\";\nimport * as AccordionPrimitive from \"@radix-ui/react-accordion\";\nimport { ChevronDown } from \"lucide-react\";\nimport { cn } from \"@/lib/utils\";\n\nconst Accordion = AccordionPrimitive.Root;\n\nconst AccordionItem = React.forwardRef<\n  React.ElementRef<typeof AccordionPrimitive.Item>,\n  React.ComponentPropsWithoutRef<typeof AccordionPrimitive.Item>\n>(({ className, ...props }, ref) => (\n  <AccordionPrimitive.Item ref={ref} className={cn(\"border-b\", className)} {...props} />\n));\nAccordionItem.displayName = \"AccordionItem\";\n\nconst AccordionTrigger = React.forwardRef<\n  React.ElementRef<typeof AccordionPrimitive.Trigger>,\n  React.ComponentPropsWithoutRef<typeof AccordionPrimitive.Trigger>\n>(({ className, children, ...props }, ref) => (\n  <AccordionPrimitive.Header className=\"flex\">\n    <AccordionPrimitive.Trigger\n      ref={ref}\n      className={cn(\n        \"flex flex-1 items-center justify-between py-4 text-sm font-medium font-sans transition-all hover:underline [&[data-state=open]>svg]:rotate-180\",\n        className,\n      )}\n      {...props}\n    >\n      {children}\n      <ChevronDown className=\"size-4 shrink-0 text-muted-foreground transition-transform duration-200\" />\n    </AccordionPrimitive.Trigger>\n  </AccordionPrimitive.Header>\n));\nAccordionTrigger.displayName = AccordionPrimitive.Trigger.displayName;\n\nconst AccordionContent = React.forwardRef<\n  React.ElementRef<typeof AccordionPrimitive.Content>,\n  React.ComponentPropsWithoutRef<typeof AccordionPrimitive.Content>\n>(({ className, children, ...props }, ref) => (\n  <AccordionPrimitive.Content\n    ref={ref}\n    className=\"overflow-hidden text-sm font-sans data-[state=closed]:animate-accordion-up data-[state=open]:animate-accordion-down\"\n    {...props}\n  >\n    <div className={cn(\"pb-4 pt-0\", className)}>{children}</div>\n  </AccordionPrimitive.Content>\n));\nAccordionContent.displayName = AccordionPrimitive.Content.displayName;\n\nexport { Accordion, AccordionItem, AccordionTrigger, AccordionContent };\n",
      "type": "registry:ui",
      "target": "components/ui/accordion.tsx"
    },
    {
      "path": "registry/kinetixui/lib/utils.ts",
      "content": "import { type ClassValue, clsx } from \"clsx\";\nimport { twMerge } from \"tailwind-merge\";\n\nexport function cn(...inputs: ClassValue[]) {\n  return twMerge(clsx(inputs));\n}\n",
      "type": "registry:lib",
      "target": "lib/utils.ts"
    }
  ]
}