{
  "$schema": "https://kinetixui.com/schema/registry-item.json",
  "name": "date-picker",
  "title": "Date Picker",
  "description": "Ported onto the KinetixUI token contract.",
  "dependencies": [
    "clsx",
    "date-fns",
    "lucide-react",
    "tailwind-merge"
  ],
  "registryDependencies": [
    "tokens",
    "calendar",
    "popover"
  ],
  "files": [
    {
      "path": "registry/kinetixui/ui/date-picker.tsx",
      "content": "\"use client\";\n\nimport * as React from \"react\";\nimport { CalendarIcon } from \"lucide-react\";\nimport { format } from \"date-fns\";\nimport { cn } from \"@/lib/utils\";\nimport { Calendar, type CalendarProps } from \"@/components/ui/calendar\";\nimport { Popover, PopoverContent, PopoverTrigger } from \"@/components/ui/popover\";\n\n/**\n * DatePicker — a text-field trigger + calendar popover. Composes the\n * existing `Popover` + `Calendar`; single-date only — for a range, compose\n * `Calendar mode=\"range\"` directly.\n */\nexport interface DatePickerProps {\n  value?: Date;\n  onChange?: (date: Date | undefined) => void;\n  placeholder?: string;\n  label?: React.ReactNode;\n  helperText?: React.ReactNode;\n  error?: boolean;\n  disabled?: boolean;\n  className?: string;\n  formatStr?: string;\n  calendarProps?: Omit<CalendarProps, \"mode\" | \"selected\" | \"onSelect\">;\n}\n\nconst DatePicker = React.forwardRef<HTMLButtonElement, DatePickerProps>(\n  ({ value, onChange, placeholder = \"Select date\", label, helperText, error, disabled, className, formatStr = \"PP\", calendarProps }, ref) => {\n    const [open, setOpen] = React.useState(false);\n\n    return (\n      <div className={cn(\"flex flex-col gap-1.5 font-sans\", className)}>\n        {label && <label className=\"text-label-md font-medium text-foreground\">{label}</label>}\n        <Popover open={open} onOpenChange={setOpen}>\n          <PopoverTrigger asChild>\n            {/* A field, not a button: the text-entry contract (TOKENS.md, \"Text entry and navigation\") as\n                DateRangeInput's trigger draws it, so the two date fields and Input share one edge, radius and\n                height. It was an Outline Button, whose `--input` edge is 2.2:1 and whose focus left the edge alone. */}\n            <button\n              ref={ref}\n              type=\"button\"\n              disabled={disabled}\n              aria-invalid={error || undefined}\n              className={cn(\n                \"flex min-h-11 w-full min-w-0 items-center gap-2 rounded-field border border-muted-foreground/80 bg-background px-3 py-3 text-start text-body-md text-foreground outline-none transition-[border-color,box-shadow] duration-instant ease-standard focus-visible:border-action focus-visible:shadow-focus disabled:pointer-events-none disabled:opacity-disabled [@media(hover:hover)]:hover:border-muted-foreground\",\n                \"aria-[invalid=true]:border-destructive aria-[invalid=true]:focus-visible:shadow-focus-destructive\",\n              )}\n            >\n              <CalendarIcon aria-hidden className=\"size-4 shrink-0 text-muted-foreground\" />\n              <span className={cn(\"min-w-0 [overflow-wrap:anywhere]\", !value && \"text-muted-foreground\")}>\n                {value ? format(value, formatStr) : placeholder}\n              </span>\n            </button>\n          </PopoverTrigger>\n          <PopoverContent className=\"w-auto p-0\" align=\"start\">\n            <Calendar\n              mode=\"single\"\n              selected={value}\n              onSelect={(d) => {\n                onChange?.(d);\n                setOpen(false);\n              }}\n              {...calendarProps}\n            />\n          </PopoverContent>\n        </Popover>\n        {helperText && <p className={cn(\"text-body-sm\", error ? \"text-destructive\" : \"text-muted-foreground\")}>{helperText}</p>}\n      </div>\n    );\n  },\n);\nDatePicker.displayName = \"DatePicker\";\n\nexport { DatePicker };\n",
      "type": "registry:ui",
      "target": "components/ui/date-picker.tsx"
    },
    {
      "path": "registry/kinetixui/lib/utils.ts",
      "content": "import { type ClassValue, clsx } from \"clsx\";\nimport { extendTailwindMerge } from \"tailwind-merge\";\n\n// The Material type-scale utilities (`text-label-md`, `text-body-sm`, …) come\n// from `fontSize` in tailwind.config.ts. Without this, tailwind-merge reads them\n// as text *colours* and drops a real colour class (`text-primary-foreground`).\nconst twMerge = extendTailwindMerge({\n  extend: {\n    classGroups: {\n      \"font-size\": [\n        {\n          text: [\n            \"display-lg\", \"display-md\", \"display-sm\",\n            \"headline-lg\", \"headline-md\", \"headline-sm\",\n            \"title-lg\", \"title-md\", \"title-sm\", \"title-dialog\",\n            \"label-lg\", \"label-md\", \"label-sm\",\n            \"body-lg\", \"body-md\", \"body-sm\",\n          ],\n        },\n      ],\n    },\n  },\n});\n\n/** Merges Tailwind class names, resolving conflicts (clsx + tailwind-merge). */\nexport function cn(...inputs: ClassValue[]) {\n  return twMerge(clsx(inputs));\n}\n",
      "type": "registry:lib",
      "target": "lib/utils.ts"
    }
  ],
  "type": "registry:ui"
}