{
  "$schema": "https://kinetixui.com/schema/registry-item.json",
  "name": "select",
  "title": "Select",
  "description": "Reconciled 1:1 with the KinetixUI design source, node 54855:13882.",
  "dependencies": [
    "@radix-ui/react-select",
    "clsx",
    "lucide-react",
    "tailwind-merge"
  ],
  "registryDependencies": [
    "tokens",
    "direction-provider"
  ],
  "files": [
    {
      "path": "registry/kinetixui/ui/select.tsx",
      "content": "\"use client\";\n\nimport * as React from \"react\";\nimport * as SelectPrimitive from \"@radix-ui/react-select\";\nimport { Check, ChevronDown, ChevronUp } from \"lucide-react\";\nimport { cn } from \"@/lib/utils\";\nimport { withDirectionalPortal } from \"@/components/ui/direction-provider\";\n\n/**\n * Select — reconciled 1:1 with the KinetixUI design source, node 54855:13882.\n * The trigger mirrors Input: `rounded-field` (`--radius-field`), `--spacing-3` pad, Body Medium text, a soft `--shadow-focus`\n * glow, `--destructive` on aria-invalid — and Input's text-entry state contract (TOKENS.md, \"Text entry and\n * navigation\"): an 80% `--muted-foreground` edge at rest, full strength under a hovering pointer, and hover\n * never over focus, an open list, invalid or disabled. Select has no read-only state.\n */\nconst SelectPortal = withDirectionalPortal(SelectPrimitive.Portal);\nconst Select = SelectPrimitive.Root;\nconst SelectGroup = SelectPrimitive.Group;\nconst SelectValue = SelectPrimitive.Value;\n\nconst SelectTrigger = React.forwardRef<\n  React.ElementRef<typeof SelectPrimitive.Trigger>,\n  React.ComponentPropsWithoutRef<typeof SelectPrimitive.Trigger>\n>(({ className, children, ...props }, ref) => (\n  <SelectPrimitive.Trigger\n    ref={ref}\n    className={cn(\n      \"flex min-h-[44px] w-full items-center justify-between rounded-field border border-muted-foreground/80 bg-background px-3 py-3\",\n      \"font-sans text-body-md text-foreground\",\n      // The value wraps rather than being clamped to one line. `line-clamp-1` was invisible while the\n      // type scale was px — the value always fitted — but once text follows the reader's setting a\n      // two-line value is cut off at 200% with no ellipsis (measured: span needs 80px, gets 40px, and\n      // computed `text-overflow` is `clip`, not `ellipsis`), so \"Select a fruit\" rendered as \"Select a\".\n      // The trigger is already `min-h`, so letting it grow is what it was built for, and it matches how\n      // Input and Textarea absorb their own text. WCAG 1.4.4 asks for no loss of content at 200%.\n      //\n      // `min-w-0` and `overflow-wrap: anywhere` are what make that safe. A flex child keeps its\n      // min-content width by default, so a value with no break opportunity — an identifier, a URL with\n      // no separators — would simply not shrink: measured at 282px inside a 220px trigger, overflowing\n      // it and pushing the chevron outside. `line-clamp-1` had been hiding that by clipping. Breaking\n      // the token is the behaviour that keeps both the value and the chevron inside the control.\n      \"data-[placeholder]:text-muted-foreground [&>span]:min-w-0 [&>span]:[overflow-wrap:anywhere]\",\n      \"outline-none transition-[border-color,box-shadow,background-color] duration-instant ease-standard\",\n      \"[@media(hover:hover)]:enabled:hover:[&:not(:focus):not([aria-invalid=true]):not([data-state=open])]:border-muted-foreground\",\n      \"focus:border-action focus:shadow-focus\",\n      \"data-[state=open]:border-action\",\n      \"aria-[invalid=true]:border-destructive aria-[invalid=true]:focus:border-destructive aria-[invalid=true]:focus:shadow-focus-destructive\",\n      \"disabled:cursor-not-allowed disabled:opacity-disabled\",\n      className,\n    )}\n    {...props}\n  >\n    {children}\n    <SelectPrimitive.Icon asChild>\n      {/* opacity-60 (not --opacity-muted's 0.7) is a pre-existing\n          inconsistency — left as a literal, see dropdown-menu.tsx */}\n      <ChevronDown className=\"size-4 shrink-0 opacity-60\" />\n    </SelectPrimitive.Icon>\n  </SelectPrimitive.Trigger>\n));\nSelectTrigger.displayName = SelectPrimitive.Trigger.displayName;\n\nconst SelectContent = React.forwardRef<\n  React.ElementRef<typeof SelectPrimitive.Content>,\n  React.ComponentPropsWithoutRef<typeof SelectPrimitive.Content>\n>(({ className, children, position = \"popper\", ...props }, ref) => (\n  <SelectPortal>\n    <SelectPrimitive.Content\n      ref={ref}\n      position={position}\n      className={cn(\n        \"relative z-overlay max-h-96 min-w-[8rem] overflow-hidden rounded-md border bg-popover text-popover-foreground shadow-md font-sans\",\n        \"data-[state=open]:animate-in data-[state=closed]:animate-out data-[state=closed]:fade-out-0 data-[state=open]:fade-in-0 data-[state=closed]:zoom-out-95 data-[state=open]:zoom-in-95 data-[state=open]:duration-fast data-[state=open]:ease-enter data-[state=closed]:duration-instant data-[state=closed]:ease-exit\",\n        position === \"popper\" && \"data-[side=bottom]:translate-y-1 data-[side=top]:-translate-y-1\",\n        className,\n      )}\n      {...props}\n    >\n      <SelectPrimitive.ScrollUpButton className=\"flex h-6 items-center justify-center\">\n        <ChevronUp className=\"size-4\" />\n      </SelectPrimitive.ScrollUpButton>\n      <SelectPrimitive.Viewport\n        className={cn(\"p-1\", position === \"popper\" && \"h-[var(--radix-select-trigger-height)] w-full min-w-[var(--radix-select-trigger-width)]\")}\n      >\n        {children}\n      </SelectPrimitive.Viewport>\n      <SelectPrimitive.ScrollDownButton className=\"flex h-6 items-center justify-center\">\n        <ChevronDown className=\"size-4\" />\n      </SelectPrimitive.ScrollDownButton>\n    </SelectPrimitive.Content>\n  </SelectPortal>\n));\nSelectContent.displayName = SelectPrimitive.Content.displayName;\n\nconst SelectLabel = React.forwardRef<\n  React.ElementRef<typeof SelectPrimitive.Label>,\n  React.ComponentPropsWithoutRef<typeof SelectPrimitive.Label>\n>(({ className, ...props }, ref) => (\n  <SelectPrimitive.Label ref={ref} className={cn(\"px-2 py-1.5 text-sm font-semibold\", className)} {...props} />\n));\nSelectLabel.displayName = SelectPrimitive.Label.displayName;\n\nconst SelectItem = React.forwardRef<\n  React.ElementRef<typeof SelectPrimitive.Item>,\n  React.ComponentPropsWithoutRef<typeof SelectPrimitive.Item>\n>(({ className, children, ...props }, ref) => (\n  <SelectPrimitive.Item\n    ref={ref}\n    className={cn(\n      \"relative flex w-full cursor-default select-none items-center rounded-sm py-1.5 ps-8 pe-2 text-sm outline-none\",\n      \"focus:bg-accent focus:text-accent-foreground focus:ring-1 focus:ring-inset focus:ring-ring data-[disabled]:pointer-events-none data-[disabled]:opacity-disabled\",\n      className,\n    )}\n    {...props}\n  >\n    <span className=\"absolute start-2 flex size-3.5 items-center justify-center\">\n      <SelectPrimitive.ItemIndicator>\n        <Check className=\"size-4\" />\n      </SelectPrimitive.ItemIndicator>\n    </span>\n    <SelectPrimitive.ItemText>{children}</SelectPrimitive.ItemText>\n  </SelectPrimitive.Item>\n));\nSelectItem.displayName = SelectPrimitive.Item.displayName;\n\nconst SelectSeparator = React.forwardRef<\n  React.ElementRef<typeof SelectPrimitive.Separator>,\n  React.ComponentPropsWithoutRef<typeof SelectPrimitive.Separator>\n>(({ className, ...props }, ref) => (\n  <SelectPrimitive.Separator ref={ref} className={cn(\"-mx-1 my-1 h-px bg-muted\", className)} {...props} />\n));\nSelectSeparator.displayName = SelectPrimitive.Separator.displayName;\n\nexport {\n  Select,\n  SelectGroup,\n  SelectValue,\n  SelectTrigger,\n  SelectContent,\n  SelectLabel,\n  SelectItem,\n  SelectSeparator,\n};\n",
      "type": "registry:ui",
      "target": "components/ui/select.tsx"
    },
    {
      "path": "registry/kinetixui/lib/utils.ts",
      "content": "import { type ClassValue, clsx } from \"clsx\";\nimport { extendTailwindMerge } from \"tailwind-merge\";\n\n// The Material type-scale utilities (`text-label-md`, `text-body-sm`, …) come\n// from `fontSize` in tailwind.config.ts. Without this, tailwind-merge reads them\n// as text *colours* and drops a real colour class (`text-primary-foreground`).\nconst twMerge = extendTailwindMerge({\n  extend: {\n    classGroups: {\n      \"font-size\": [\n        {\n          text: [\n            \"display-lg\", \"display-md\", \"display-sm\",\n            \"headline-lg\", \"headline-md\", \"headline-sm\",\n            \"title-lg\", \"title-md\", \"title-sm\", \"title-dialog\",\n            \"label-lg\", \"label-md\", \"label-sm\",\n            \"body-lg\", \"body-md\", \"body-sm\",\n          ],\n        },\n      ],\n    },\n  },\n});\n\n/** Merges Tailwind class names, resolving conflicts (clsx + tailwind-merge). */\nexport function cn(...inputs: ClassValue[]) {\n  return twMerge(clsx(inputs));\n}\n",
      "type": "registry:lib",
      "target": "lib/utils.ts"
    }
  ],
  "type": "registry:ui"
}