{
  "$schema": "https://kinetixui.com/schema/registry-item.json",
  "name": "checkbox",
  "title": "Checkbox",
  "description": "Reconciled 1:1 with the KinetixUI design source, node 54863:483.",
  "dependencies": [
    "@radix-ui/react-checkbox",
    "clsx",
    "lucide-react",
    "tailwind-merge"
  ],
  "registryDependencies": [
    "tokens"
  ],
  "files": [
    {
      "path": "registry/kinetixui/ui/checkbox.tsx",
      "content": "\"use client\";\n\nimport * as React from \"react\";\nimport * as CheckboxPrimitive from \"@radix-ui/react-checkbox\";\nimport { Check, Minus } from \"lucide-react\";\nimport { cn } from \"@/lib/utils\";\n\n/**\n * Checkbox — from the KinetixUI design source, node 54863:483: 18px box, 4px radius, 2px border, checked /\n * indeterminate fill = `--action`, focus = 2px `--ring` offset.\n *\n * It follows the selection-control state contract (TOKENS.md, \"Selection controls\"):\n *\n *   rest      unchecked boundary `--muted-foreground`, not `--input`. The box is the only thing that says a\n *             checkbox is there, so its edge must clear SC 1.4.11's 3:1 (`--input` is 2.2:1 light / 2.7:1\n *             dark — a tracked exception for field outlines, where the field's fill and label carry it).\n *   hover     a pointer that can hover: a `--foreground` state layer at 8% around the box, and the unchecked\n *             edge darkens to `--foreground`; checked fills step to `--action`/90\n *   pressed   the state layer deepens to 14%; checked fills to `--action`/85\n *   checked   `--action` fill AND a glyph — shape, not only colour\n *   invalid   `aria-invalid=\"true\"` → `--destructive` edge (and fill when checked); the field's error text\n *             is the non-colour cue\n *   focus     the 2px offset ring, `!important` so no hover or pressed layer can cover it\n *   disabled  `--opacity-disabled`, and the hover/pressed layers are keyed on `:enabled`, so it never answers\n *\n * Motion (MX1b-1b) has two tiers on one element, because a transition is timed by the property that changes:\n *\n *   selection-state  fill, border and text colour on `--duration-fast` (200ms): checking, unchecking and\n *                    mixed all move the box's colour over the same 200ms\n *   press-feedback   the state layer (box-shadow) on `--duration-instant` (100ms), so hover and press answer\n *                    at once. The box's own hover/press colour step rides on the colour tier; the layer is the\n *                    immediate answer\n *\n * The glyph is chosen by Radix's state, not by the `checked` prop. Choosing from the prop drew a tick under\n * an uncontrolled `defaultChecked=\"indeterminate\"` while announcing \"mixed\", because the prop is undefined\n * there. Both glyphs are rendered and the Indicator's own `data-state` shows one; the Indicator stays\n * mounted so it can fade in on `fast`. It leaves at once rather than fading: from mixed to unchecked the\n * glyph left on screen would be the tick, the wrong one. Between checked and mixed the glyph swaps in the\n * same frame as `aria-checked`. Reduced motion removes every transition and lands on the same end state.\n */\nconst Checkbox = React.forwardRef<\n  React.ElementRef<typeof CheckboxPrimitive.Root>,\n  React.ComponentPropsWithoutRef<typeof CheckboxPrimitive.Root>\n>(({ className, ...props }, ref) => (\n  <CheckboxPrimitive.Root\n    ref={ref}\n    className={cn(\n      // 1.125rem, not the 18px it replaces: identical at the default root size, but a reader who raises\n      // their browser's default font size scales rem and not px. At 200% the box stayed 18x18 beside a\n      // label that doubled — the control shrank by half relative to its own text, and its hit target with it.\n      \"peer size-[1.125rem] shrink-0 rounded-sm border-2 border-muted-foreground outline-none\",\n      // One literal, so the property list and its per-property tiers cannot be separated by an edit.\n      \"transition-[background-color,color,border-color,box-shadow] ease-standard [transition-duration:var(--duration-fast),var(--duration-fast),var(--duration-fast),var(--duration-instant)]\",\n      \"motion-reduce:transition-none\",\n      \"data-[state=checked]:border-action data-[state=checked]:bg-action data-[state=checked]:text-action-foreground\",\n      \"data-[state=indeterminate]:border-action data-[state=indeterminate]:bg-action data-[state=indeterminate]:text-action-foreground\",\n      // `aria-[invalid=true]:`, not `aria-invalid:` — Tailwind 3 has no `invalid` in its aria variants, so\n      // the short form compiled to nothing and an invalid checkbox looked exactly like a valid one.\n      \"aria-[invalid=true]:border-destructive aria-[invalid=true]:data-[state=checked]:bg-destructive aria-[invalid=true]:data-[state=indeterminate]:bg-destructive\",\n      // The state layer: the same for every value, so hover and press read the same way checked or not.\n      \"[@media(hover:hover)]:enabled:hover:[box-shadow:0_0_0_5px_hsl(var(--foreground)/0.08)]\",\n      // Pressed is written twice: bare for touch, and again inside the hover media query, because Tailwind\n      // emits media-wrapped utilities after plain ones and the hover layer would otherwise outrank the press.\n      \"enabled:active:[box-shadow:0_0_0_5px_hsl(var(--foreground)/0.14)]\",\n      \"[@media(hover:hover)]:enabled:active:[box-shadow:0_0_0_5px_hsl(var(--foreground)/0.14)]\",\n      // ...and the box itself answers in the colour it already has. Valid only: an invalid box keeps its\n      // `--destructive` edge under the pointer, or hovering would erase the one cue the box carries.\n      \"[@media(hover:hover)]:enabled:hover:[&[data-state=unchecked]:not([aria-invalid=true])]:border-foreground\",\n      \"[@media(hover:hover)]:enabled:hover:[&:is([data-state=checked],[data-state=indeterminate]):not([aria-invalid=true])]:bg-action/90\",\n      \"enabled:active:[&:is([data-state=checked],[data-state=indeterminate]):not([aria-invalid=true])]:bg-action/85\",\n      \"[@media(hover:hover)]:enabled:active:[&:is([data-state=checked],[data-state=indeterminate]):not([aria-invalid=true])]:bg-action/85\",\n      \"focus-visible:!ring-2 focus-visible:ring-ring focus-visible:ring-offset-2 focus-visible:ring-offset-background\",\n      \"disabled:cursor-not-allowed disabled:opacity-disabled\",\n      className,\n    )}\n    {...props}\n  >\n    <CheckboxPrimitive.Indicator\n      forceMount\n      className={cn(\n        \"group/indicator flex items-center justify-center text-current\",\n        \"opacity-0 data-[state=checked]:opacity-100 data-[state=indeterminate]:opacity-100\",\n        \"transition-opacity duration-fast ease-standard data-[state=unchecked]:transition-none motion-reduce:transition-none\",\n      )}\n    >\n      <Check className=\"size-3 group-data-[state=indeterminate]/indicator:hidden\" strokeWidth={3} />\n      <Minus className=\"hidden size-3 group-data-[state=indeterminate]/indicator:block\" />\n    </CheckboxPrimitive.Indicator>\n  </CheckboxPrimitive.Root>\n));\nCheckbox.displayName = CheckboxPrimitive.Root.displayName;\n\nexport { Checkbox };\n",
      "type": "registry:ui",
      "target": "components/ui/checkbox.tsx"
    },
    {
      "path": "registry/kinetixui/lib/utils.ts",
      "content": "import { type ClassValue, clsx } from \"clsx\";\nimport { extendTailwindMerge } from \"tailwind-merge\";\n\n// The Material type-scale utilities (`text-label-md`, `text-body-sm`, …) come\n// from `fontSize` in tailwind.config.ts. Without this, tailwind-merge reads them\n// as text *colours* and drops a real colour class (`text-primary-foreground`).\nconst twMerge = extendTailwindMerge({\n  extend: {\n    classGroups: {\n      \"font-size\": [\n        {\n          text: [\n            \"display-lg\", \"display-md\", \"display-sm\",\n            \"headline-lg\", \"headline-md\", \"headline-sm\",\n            \"title-lg\", \"title-md\", \"title-sm\", \"title-dialog\",\n            \"label-lg\", \"label-md\", \"label-sm\",\n            \"body-lg\", \"body-md\", \"body-sm\",\n          ],\n        },\n      ],\n    },\n  },\n});\n\n/** Merges Tailwind class names, resolving conflicts (clsx + tailwind-merge). */\nexport function cn(...inputs: ClassValue[]) {\n  return twMerge(clsx(inputs));\n}\n",
      "type": "registry:lib",
      "target": "lib/utils.ts"
    }
  ],
  "type": "registry:ui"
}