{
  "$schema": "https://kinetixui.com/schema/registry-item.json",
  "name": "toggle-group",
  "title": "Toggle Group",
  "description": "Ported onto the KinetixUI token contract.",
  "dependencies": [
    "@radix-ui/react-toggle-group",
    "class-variance-authority",
    "clsx",
    "tailwind-merge"
  ],
  "registryDependencies": [
    "tokens",
    "toggle"
  ],
  "files": [
    {
      "path": "registry/kinetixui/ui/toggle-group.tsx",
      "content": "\"use client\";\n\nimport * as React from \"react\";\nimport * as ToggleGroupPrimitive from \"@radix-ui/react-toggle-group\";\nimport { type VariantProps } from \"class-variance-authority\";\nimport { cn } from \"@/lib/utils\";\nimport { toggleVariants } from \"@/components/ui/toggle\";\n\nconst ToggleGroupContext = React.createContext<VariantProps<typeof toggleVariants>>({\n  size: \"default\",\n  variant: \"default\",\n});\n\nconst ToggleGroup = React.forwardRef<\n  React.ElementRef<typeof ToggleGroupPrimitive.Root>,\n  React.ComponentPropsWithoutRef<typeof ToggleGroupPrimitive.Root> & VariantProps<typeof toggleVariants>\n>(({ className, variant, size, children, ...props }, ref) => (\n  // Items wrap rather than overflow: at 320px with 200% text a row of three labelled items is wider than\n  // the screen, and a group that scrolls the page sideways fails reflow (check:toggle-motion, \"matrix\").\n  <ToggleGroupPrimitive.Root ref={ref} className={cn(\"flex flex-wrap items-center gap-1\", className)} {...props}>\n    <ToggleGroupContext.Provider value={{ variant, size }}>{children}</ToggleGroupContext.Provider>\n  </ToggleGroupPrimitive.Root>\n));\nToggleGroup.displayName = ToggleGroupPrimitive.Root.displayName;\n\nconst ToggleGroupItem = React.forwardRef<\n  React.ElementRef<typeof ToggleGroupPrimitive.Item>,\n  React.ComponentPropsWithoutRef<typeof ToggleGroupPrimitive.Item> & VariantProps<typeof toggleVariants>\n>(({ className, children, variant, size, ...props }, ref) => {\n  const ctx = React.useContext(ToggleGroupContext);\n  return (\n    <ToggleGroupPrimitive.Item\n      ref={ref}\n      className={cn(toggleVariants({ variant: ctx.variant || variant, size: ctx.size || size }), className)}\n      {...props}\n    >\n      {children}\n    </ToggleGroupPrimitive.Item>\n  );\n});\nToggleGroupItem.displayName = ToggleGroupPrimitive.Item.displayName;\n\nexport { ToggleGroup, ToggleGroupItem };\n",
      "type": "registry:ui",
      "target": "components/ui/toggle-group.tsx"
    },
    {
      "path": "registry/kinetixui/lib/utils.ts",
      "content": "import { type ClassValue, clsx } from \"clsx\";\nimport { extendTailwindMerge } from \"tailwind-merge\";\n\n// The Material type-scale utilities (`text-label-md`, `text-body-sm`, …) come\n// from `fontSize` in tailwind.config.ts. Without this, tailwind-merge reads them\n// as text *colours* and drops a real colour class (`text-primary-foreground`).\nconst twMerge = extendTailwindMerge({\n  extend: {\n    classGroups: {\n      \"font-size\": [\n        {\n          text: [\n            \"display-lg\", \"display-md\", \"display-sm\",\n            \"headline-lg\", \"headline-md\", \"headline-sm\",\n            \"title-lg\", \"title-md\", \"title-sm\", \"title-dialog\",\n            \"label-lg\", \"label-md\", \"label-sm\",\n            \"body-lg\", \"body-md\", \"body-sm\",\n          ],\n        },\n      ],\n    },\n  },\n});\n\n/** Merges Tailwind class names, resolving conflicts (clsx + tailwind-merge). */\nexport function cn(...inputs: ClassValue[]) {\n  return twMerge(clsx(inputs));\n}\n",
      "type": "registry:lib",
      "target": "lib/utils.ts"
    }
  ],
  "type": "registry:ui"
}