{
  "$schema": "https://ui.shadcn.com/schema/registry-item.json",
  "name": "drawer",
  "type": "registry:ui",
  "title": "Drawer",
  "description": "Ported onto the KinetixUI token contract.",
  "dependencies": [
    "vaul"
  ],
  "registryDependencies": [
    "tokens"
  ],
  "files": [
    {
      "path": "registry/kinetixui/ui/drawer.tsx",
      "content": "\"use client\";\n\nimport * as React from \"react\";\nimport { Drawer as DrawerPrimitive } from \"vaul\";\nimport { cn } from \"@/lib/utils\";\n\nconst Drawer = ({ shouldScaleBackground = true, ...props }: React.ComponentProps<typeof DrawerPrimitive.Root>) => (\n  <DrawerPrimitive.Root shouldScaleBackground={shouldScaleBackground} {...props} />\n);\nDrawer.displayName = \"Drawer\";\n\nconst DrawerTrigger = DrawerPrimitive.Trigger;\nconst DrawerPortal = DrawerPrimitive.Portal;\nconst DrawerClose = DrawerPrimitive.Close;\n\nconst DrawerOverlay = React.forwardRef<\n  React.ElementRef<typeof DrawerPrimitive.Overlay>,\n  React.ComponentPropsWithoutRef<typeof DrawerPrimitive.Overlay>\n>(({ className, ...props }, ref) => (\n  <DrawerPrimitive.Overlay ref={ref} className={cn(\"fixed inset-0 z-50 bg-foreground/40\", className)} {...props} />\n));\nDrawerOverlay.displayName = DrawerPrimitive.Overlay.displayName;\n\nconst DrawerContent = React.forwardRef<\n  React.ElementRef<typeof DrawerPrimitive.Content>,\n  React.ComponentPropsWithoutRef<typeof DrawerPrimitive.Content>\n>(({ className, children, ...props }, ref) => (\n  <DrawerPortal>\n    <DrawerOverlay />\n    <DrawerPrimitive.Content\n      ref={ref}\n      className={cn(\n        \"fixed inset-x-0 bottom-0 z-50 mt-24 flex h-auto flex-col rounded-t-[10px] border bg-background font-sans\",\n        className,\n      )}\n      {...props}\n    >\n      <div className=\"mx-auto mt-4 h-2 w-[100px] rounded-full bg-muted\" />\n      {children}\n    </DrawerPrimitive.Content>\n  </DrawerPortal>\n));\nDrawerContent.displayName = \"DrawerContent\";\n\nconst DrawerHeader = ({ className, ...props }: React.HTMLAttributes<HTMLDivElement>) => (\n  <div className={cn(\"grid gap-1.5 p-4 text-center sm:text-left\", className)} {...props} />\n);\nDrawerHeader.displayName = \"DrawerHeader\";\n\nconst DrawerFooter = ({ className, ...props }: React.HTMLAttributes<HTMLDivElement>) => (\n  <div className={cn(\"mt-auto flex flex-col gap-2 p-4\", className)} {...props} />\n);\nDrawerFooter.displayName = \"DrawerFooter\";\n\nconst DrawerTitle = React.forwardRef<\n  React.ElementRef<typeof DrawerPrimitive.Title>,\n  React.ComponentPropsWithoutRef<typeof DrawerPrimitive.Title>\n>(({ className, ...props }, ref) => (\n  <DrawerPrimitive.Title ref={ref} className={cn(\"text-lg font-semibold leading-none tracking-tight\", className)} {...props} />\n));\nDrawerTitle.displayName = DrawerPrimitive.Title.displayName;\n\nconst DrawerDescription = React.forwardRef<\n  React.ElementRef<typeof DrawerPrimitive.Description>,\n  React.ComponentPropsWithoutRef<typeof DrawerPrimitive.Description>\n>(({ className, ...props }, ref) => (\n  <DrawerPrimitive.Description ref={ref} className={cn(\"text-sm text-muted-foreground\", className)} {...props} />\n));\nDrawerDescription.displayName = DrawerPrimitive.Description.displayName;\n\nexport {\n  Drawer,\n  DrawerPortal,\n  DrawerOverlay,\n  DrawerTrigger,\n  DrawerClose,\n  DrawerContent,\n  DrawerHeader,\n  DrawerFooter,\n  DrawerTitle,\n  DrawerDescription,\n};\n",
      "type": "registry:ui",
      "target": "components/ui/drawer.tsx"
    },
    {
      "path": "registry/kinetixui/lib/utils.ts",
      "content": "import { type ClassValue, clsx } from \"clsx\";\nimport { twMerge } from \"tailwind-merge\";\n\nexport function cn(...inputs: ClassValue[]) {\n  return twMerge(clsx(inputs));\n}\n",
      "type": "registry:lib",
      "target": "lib/utils.ts"
    }
  ]
}