{
  "$schema": "https://kinetixui.com/schema/registry-item.json",
  "name": "audio-player",
  "title": "Audio Player",
  "description": "Ported onto the KinetixUI token contract.",
  "dependencies": [
    "clsx",
    "lucide-react",
    "tailwind-merge"
  ],
  "registryDependencies": [
    "tokens",
    "slider"
  ],
  "files": [
    {
      "path": "registry/kinetixui/ui/audio-player.tsx",
      "content": "\"use client\";\n\nimport * as React from \"react\";\nimport { Pause, Play, SkipBack, SkipForward } from \"lucide-react\";\nimport { cn } from \"@/lib/utils\";\nimport { Slider } from \"@/components/ui/slider\";\n\n/**\n * AudioPlayer — interactive playback controls, full or mini. Wraps a native\n * <audio> element: play / pause, scrubber with time, ±10s skip, and optional\n * prev / next track callbacks.\n */\nexport interface AudioPlayerProps extends React.HTMLAttributes<HTMLDivElement> {\n  src: string;\n  variant?: \"full\" | \"mini\";\n  title?: string;\n  artist?: string;\n  coverSrc?: string;\n  /** ±10s skip step, seconds */\n  skipBy?: number;\n  onPrev?: () => void;\n  onNext?: () => void;\n}\n\nfunction fmt(t: number) {\n  if (!Number.isFinite(t)) return \"0:00\";\n  const m = Math.floor(t / 60);\n  const s = Math.floor(t % 60);\n  return `${m}:${s.toString().padStart(2, \"0\")}`;\n}\n\nconst AudioPlayer = React.forwardRef<HTMLDivElement, AudioPlayerProps>(\n  ({ src, variant = \"full\", title, artist, coverSrc, skipBy = 10, onPrev, onNext, className, ...props }, ref) => {\n    const audioRef = React.useRef<HTMLAudioElement>(null);\n    const [playing, setPlaying] = React.useState(false);\n    const [current, setCurrent] = React.useState(0);\n    const [duration, setDuration] = React.useState(0);\n\n    const toggle = () => {\n      const a = audioRef.current;\n      if (!a) return;\n      if (a.paused) void a.play();\n      else a.pause();\n    };\n    const seek = (t: number) => {\n      const a = audioRef.current;\n      if (a) a.currentTime = Math.max(0, Math.min(duration || 0, t));\n    };\n    const skip = (delta: number) => seek(current + delta);\n\n    const audio = (\n      <audio\n        ref={audioRef}\n        src={src}\n        preload=\"metadata\"\n        onPlay={() => setPlaying(true)}\n        onPause={() => setPlaying(false)}\n        onTimeUpdate={(e) => setCurrent(e.currentTarget.currentTime)}\n        onLoadedMetadata={(e) => setDuration(e.currentTarget.duration)}\n        onEnded={() => setPlaying(false)}\n      />\n    );\n\n    const PlayPause = ({ size = 44 }: { size?: number }) => (\n      <button\n        type=\"button\"\n        onClick={toggle}\n        aria-label={playing ? \"Pause\" : \"Play\"}\n        className=\"grid shrink-0 place-items-center rounded-full bg-action text-action-foreground outline-none transition-transform hover:scale-105 focus-visible:shadow-focus\"\n        style={{ width: size, height: size }}\n      >\n        {playing ? <Pause className=\"size-1/3 fill-current\" /> : <Play className=\"size-1/3 translate-x-px fill-current\" />}\n      </button>\n    );\n\n    // disabled:opacity-40 (not --opacity-disabled's 0.5) is a real, pre-existing\n    // inconsistency — left as a literal rather than silently changing the\n    // rendered value; a design call, not a rename.\n    const iconBtn =\n      \"grid size-8 shrink-0 place-items-center rounded-full text-muted-foreground outline-none transition-colors hover:bg-muted hover:text-foreground focus-visible:text-foreground disabled:opacity-40 [&>svg]:size-4\";\n\n    if (variant === \"mini\") {\n      const pct = duration ? (current / duration) * 100 : 0;\n      return (\n        <div\n          ref={ref}\n          className={cn(\n            \"relative flex w-full max-w-[360px] items-center gap-3 overflow-hidden rounded-full border border-border bg-background p-2 pl-3 font-sans\",\n            className,\n          )}\n          {...props}\n        >\n          {audio}\n          {coverSrc ? (\n            <img src={coverSrc} alt=\"\" className=\"size-10 shrink-0 rounded-full object-cover\" />\n          ) : (\n            <div className=\"size-10 shrink-0 rounded-full bg-muted\" />\n          )}\n          <div className=\"min-w-0 flex-1\">\n            <p className=\"truncate text-label-md font-semibold text-foreground\">{title ?? \"Audio\"}</p>\n            {artist && <p className=\"truncate text-body-sm text-muted-foreground\">{artist}</p>}\n          </div>\n          <button type=\"button\" onClick={() => skip(skipBy)} aria-label={`Forward ${skipBy}s`} className={iconBtn}>\n            <SkipForward />\n          </button>\n          <PlayPause size={36} />\n          <div className=\"absolute inset-x-0 bottom-0 h-1 bg-muted\">\n            <div className=\"h-full bg-action transition-[width]\" style={{ width: `${pct}%` }} />\n          </div>\n        </div>\n      );\n    }\n\n    return (\n      <div\n        ref={ref}\n        className={cn(\"flex w-full max-w-[360px] flex-col gap-2 font-sans\", className)}\n        {...props}\n      >\n        {audio}\n        <Slider\n          value={[current]}\n          max={duration || 1}\n          step={0.5}\n          onValueChange={(vals) => seek(vals[0] ?? 0)}\n          aria-label=\"Seek\"\n        />\n        <div className=\"flex justify-between text-body-sm text-muted-foreground\">\n          <span>{fmt(current)}</span>\n          <span>{fmt(duration)}</span>\n        </div>\n        <div className=\"mt-1 flex items-center justify-center gap-3\">\n          <button type=\"button\" onClick={onPrev} disabled={!onPrev} aria-label=\"Previous track\" className={iconBtn}>\n            <SkipBack className=\"fill-current\" />\n          </button>\n          <button type=\"button\" onClick={() => skip(-skipBy)} aria-label={`Back ${skipBy}s`} className={iconBtn}>\n            <SkipBack />\n          </button>\n          <PlayPause />\n          <button type=\"button\" onClick={() => skip(skipBy)} aria-label={`Forward ${skipBy}s`} className={iconBtn}>\n            <SkipForward />\n          </button>\n          <button type=\"button\" onClick={onNext} disabled={!onNext} aria-label=\"Next track\" className={iconBtn}>\n            <SkipForward className=\"fill-current\" />\n          </button>\n        </div>\n      </div>\n    );\n  },\n);\nAudioPlayer.displayName = \"AudioPlayer\";\n\nexport { AudioPlayer };\n",
      "type": "registry:ui",
      "target": "components/ui/audio-player.tsx"
    },
    {
      "path": "registry/kinetixui/lib/utils.ts",
      "content": "import { type ClassValue, clsx } from \"clsx\";\nimport { extendTailwindMerge } from \"tailwind-merge\";\n\n// The Material type-scale utilities (`text-label-md`, `text-body-sm`, …) come\n// from `fontSize` in tailwind.config.ts. Without this, tailwind-merge reads them\n// as text *colours* and drops a real colour class (`text-primary-foreground`).\nconst twMerge = extendTailwindMerge({\n  extend: {\n    classGroups: {\n      \"font-size\": [\n        {\n          text: [\n            \"display-lg\", \"display-md\", \"display-sm\",\n            \"headline-lg\", \"headline-md\", \"headline-sm\",\n            \"title-lg\", \"title-md\", \"title-sm\", \"title-dialog\",\n            \"label-lg\", \"label-md\", \"label-sm\",\n            \"body-lg\", \"body-md\", \"body-sm\",\n          ],\n        },\n      ],\n    },\n  },\n});\n\n/** Merges Tailwind class names, resolving conflicts (clsx + tailwind-merge). */\nexport function cn(...inputs: ClassValue[]) {\n  return twMerge(clsx(inputs));\n}\n",
      "type": "registry:lib",
      "target": "lib/utils.ts"
    }
  ],
  "type": "registry:ui"
}